Death Template,,,,,,,,,,,,
All fields columns that has an asterisk(*) in their column header is important and should not be leave as blank,,,,,,,,,,,,
Important Note: Assinged Parish Priest will not be inclued in import,,,,,,,,,,,,
All Date Columns should have this date format Example: 11/12/2021 (Month/Date/Year),,,,,,,,,,,,
"If Informant or Relatives is more than 1 then separate the names with comma (,)",,,,,,,,,,,,
Do not edit above content,,,,,,,,,,,,
First Name *,Middle Name,Last Name *,Extension,Age,Residence of,Date of Death *,Place of Burial *,Date of Burial *,Informant or Relatives,Book Number,Page Number,Registry Number,Date Issued
